7750 IP 198.96.84.204.47099 > 159.203.61.229.22: Flags [.], ack 2466076, win 3892, options [nop,nop,TS val 1034096057 ecr 2464577858], length 0
16:38:14.587806 IP 159.203.61.229.22 > 198.96.84.204.47099: Flags [P.], seq 2481800:2482012, ack 1477, win 329, options [nop,nop,TS val 2464577867 ecr 1034096057], length 212
16:38:14.587874 IP 198.96.84.204.47099 > 159.203.61.229.22: Flags [.], ack 2466288, win 3889, options [nop,nop,TS val 1034096057 ecr 2464577858], length 0
16:38:14.587884 IP 198.96.84.204.47099 > 159.203.61.229.22: Flags [.], ack 2466500, win 3885, options [nop,nop,TS val 1034096057 ecr 2464577858], length 0
16:38:14.587889 IP 198.96.84.204.47099 > 159.203.61.229.22: Flags [.], ack 2466712, win 3882, options [nop,nop,TS val 1034096057 ecr 2464577858], length 0
16:38:14.587894 IP 198.96.84.204.47099 > 159.203.61.229.22: Flags [.], ack 2466924, win 3879, options [nop,nop,TS val 1034096057 ecr 2464577858], length 0
16:38:14.587900 IP 198.96.84.204.47099 > 159.203.61.229.22: Flags [.], ack 2467136, win 3892, options [nop,nop,TS val 1034096057 ecr 2464577858], length 0
16:38:14.588215 IP 159.203.61.229.22 > 198.96.84.204.47099: Flags [P.], seq 2482012:2483160, ack 1477, win 329, options [nop,nop,TS val 2464577867 ecr 1034096057], length 1148
16:38:14.588367 IP 159.203.61.229.22 > 198.96.84.204.47099: Flags [P.], seq 2483160:2483372, ack 1477, win 329, options [nop,nop,TS val 2464577867 ecr 1034096057], length 212
16:38:14.588484 IP 159.203.61.229.22 > 198.96.84.204.47099: Flags [P.], seq 2483372:2483584, ack 1477, win 329, options [nop,nop,TS val 2464577867 ecr 1034096057], length 212
16:38:14.588567 IP 159.203.61.229.22 > 198.96.84.204.47099: Flags [P.], seq 2483584:2483796, ack 1477, win 329, options [nop,nop,TS val 2464577867 ecr 1034096057], length 212
16:38:14.588682 IP 159.203.61.229.22 > 198.96.84.204.47099: Flags [P.], seq 2483796:2484008, ack 1477, win 329, options [nop,nop,TS val 2464577868 ecr 1034096057], length 212
16:38:14.588811 IP 159.203.61.229.22 > 198.96.84.204.47099: Flags [P.], seq 2484008:2484220, ack 1477, win 329, options [nop,nop,TS val 2464577868 ecr 1034096057], length 212
16:38:14.588926 IP 159.203.61.229.22 > 198.96.84.204.47099: Flags [P.], seq 2484220:2484432, ack 1477, win 329, options [nop,nop,TS val 2464577868 ecr 1034096057], length 212
16:38:14.589001 IP 198.96.84.204.47099 > 159.203.61.229.22: Flags [.], ack 2468408, win 3895, options [nop,nop,TS val 1034096059 ecr 2464577859,nop,nop,sack 1 {2468620:2470952}], length 0
16:38:14.589020 IP 198.96.84.204.47099 > 159.203.61.229.22: Flags [.], ack 2468408, win 3895, options [nop,nop,TS val 1034096059 ecr 2464577859,nop,nop,sack 1 {2468620:2471164}], length 0
16:38:14.589033 IP 159.203.61.229.22 > 198.96.84.204.47099: Flags [P.], seq 2468408:2468620, ack 1477, win 329, options [nop,nop,TS val 2464577868 ecr 1034096059], length 212
16:38:14.589080 IP 198.96.84.204.47099 > 159.203.61.229.22: Flags [.], ack 2468408, win 3895, options [nop,nop,TS val 1034096059 ecr 2464577859,nop,nop,sack 1 {2468620:2471376}], length 0
16:38:14.589091 IP 198.96.84.204.47099 > 159.203.61.229.22: Flags [.], ack 2468408, win 3895, options [nop,nop,TS val 1034096059 ecr 2464577859,nop,nop,sack 1 {2468620:2471588}], length 0
16:38:14.589097 IP 198.96.84.204.47099 > 159.203.61.229.22: Flags [.], ack 2468408, win 3895, options [nop,nop,TS val 1034096059 ecr 2464577859,nop,nop,sack 1 {2468620:2471800}], length 0
16:38:14.589189 IP 198.96.84.204.47099 > 159.203.61.229.22: Flags [.], ack 2468408, win 3895, options [nop,nop,TS val 1034096059 ecr 2464577859,nop,nop,sack 1 {2468620:2472648}], length 0
16:38:14.589202 IP 198.96.84.204.47099 > 159.203.61.229.22: Flags [.], ack 2468408, win 3895, options [nop,nop,TS val 1034096059 ecr 2464577859,nop,nop,sack 1 {2468620:2472860}], length 0
16:38:14.589351 IP 198.96.84.204.47099 > 159.203.61.229.22: Flags [.], ack 2468408, win 3895, options [nop,nop,TS val 1034096059 ecr 2464577859,nop,nop,sack 1 {2468620:2473072}], length 0
16:38:14.589369 IP 198.96.84.204.47099 > 159.203.61.229.22: Flags [.], ack 2468408, win 3895, options [nop,nop,TS val 1034096059 ecr 2464577859,nop,nop,sack 1 {2468620:2473284}], length 0
16:38:14.589375 IP 198.96.84.204.47099 > 159.203.61.229.22: Flags [.], ack 2468408, win 3895, options [nop,nop,TS val 1034096059 ecr 2464577859,nop,nop,sack 1 {2468620:2473496}], length 0
16:38:14.589381 IP 198.96.84.204.47099 > 159.203.61.229.22: Flags [.], ack 2468408, win 3895, options [nop,nop,TS val 1034096059 ecr 2464577859,nop,nop,sack 1 {2468620:2473708}], length 0
16:38:14.589387 IP 198.96.84.204.47099 > 159.203.61.229.22: Flags [.], ack 2468408, win 3895, options [nop,nop,TS val 1034096059 ecr 2464577859,nop,nop,sack 1 {2468620:2474080}], length 0
16:38:14.589392 IP 198.96.84.204.47099 > 159.203.61.229.22: Flags [.], ack 2468408, win 3895, options [nop,nop,TS val 1034096059 ecr 2464577859,nop,nop,sack 1 {2468620:2474292}], length 0
16:38:14.589398 IP 198.96.84.204.47099 > 159.203.61.229.22: Flags [.], ack 2468408, win 3895, options [nop,nop,TS val 1034096059 ecr 2464577859,nop,nop,sack 1 {2468620:2474504}], length 0
16:38:14.593873 IP 198.96.84.204.47099 > 159.203.61.229.22: Flags [.], ack 2468408, win 3895, options [nop,nop,TS val 1034096062 ecr 2464577859,nop,nop,sack 1 {2468620:2478196}], length 0
16:38:14.593928 IP 159.203.61.229.22 > 198.96.84.204.47099: Flags [.], seq 2485720:2487008, ack 1477, win 329, options [nop,nop,TS val 2464577873 ecr 1034096062], length 1288
16:38:14.593948 IP 198.96.84.204.47099 > 159.203.61.229.22: Flags [.], ack 2468408, win 3895, options [nop,nop,TS val 1034096062 ecr 2464577859,nop,nop,sack 1 {2468620:2478408}], length 0
16:38:14.593962 IP 159.203.61.229.22 > 198.96.84.204.47099: Flags [P.], seq 2487008:2487512, ack 1477, win 329, options [nop,nop,TS val 2464577873 ecr 1034096062], length 504
16:38:14.593966 IP 198.96.84.204.47099 > 159.203.61.229.22: Flags [.], ack 2468408, win 3895, options [nop,nop,TS val 1034096062 ecr 2464577859,nop,nop,sack 1 {2468620:2478620}], length 0
16:38:14.593974 IP 198.96.84.204.47099 > 159.203.61.229.22: Flags [.], ack 2468408, win 3895, options [nop,nop,TS val 1034096062 ecr 2464577859,nop,nop,sack 1 {2468620:2478832}], length 0
16:38:14.593982 IP 198.96.84.204.47099 > 159.203.61.229.22: Flags [.], ack 2468408, win 3895, options [nop,nop,TS val 1034096062 ecr 2464577859,nop,nop,sack 1 {2468620:2479044}], length 0
16:38:14.594384 IP 159.203.61.229.22 > 198.96.84.204.47099: Flags [.], seq 2487512:2488800, ack 1477, win 329, options [nop,nop,TS val 2464577873 ecr 1034096062], length 1288
16:38:14.597683 IP 198.96.84.204.47099 > 159.203.61.229.22: Flags [.], ack 2468408, win 3895, options [nop,nop,TS val 1034096065 ecr 2464577859,nop,nop,sack 1 {2468620:2482012}], length 0
16:38:14.597740 IP 159.203.61.229.22 > 198.96.84.204.47099: Flags [P.], seq 2488800:2489056, ack 1477, win 329, options [nop,nop,TS val 2464577877 ecr 1034096065], length 256
16:38:14.597763 IP 198.96.84.204.47099 > 159.203.61.229.22: Flags [P.], seq 1477:1513, ack 2468408, win 3895, options [nop,nop,TS val 1034096065 ecr 2464577859,nop,nop,sack 1 {2468620:2482012}], length 36
16:38:14.597781 IP 198.96.84.204.47099 > 159.203.61.229.22: Flags [.], ack 2468408, win 3895, options [nop,nop,TS val 1034096066 ecr 2464577859,nop,nop,sack 1 {2468620:2483160}], length 0
16:38:14.597790 IP 198.96.84.204.47099 > 159.203.61.229.22: Flags [.], ack 2468408, win 3895, options [nop,nop,TS val 1034096066 ecr 2464577859,nop,nop,sack 1 {2468620:2483372}], length 0
16:38:14.597797 IP 198.96.84.204.47099 > 159.203.61.229.22: Flags [.], ack 2468408, win 3895, options [nop,nop,TS val 1034096066 ecr 2464577859,nop,nop,sack 1 {2468620:2483584}], length 0
16:38:14.597806 IP 198.96.84.204.47099 > 159.203.61.229.22: Flags [.], ack 2468408, win 3895, options [nop,nop,TS val 1034096066 ecr 2464577859,nop,nop,sack 1 {2468620:2483796}], length 0