root@lamp-s-1vcpu-1gb-tor1-01:~# tcpdump -r 0001.pcap
reading from file 0001.pcap, link-type EN10MB (Ethernet)
16:35:14.549488 IP lamp-s-1vcpu-1gb-tor1-01.ssh > 198.96.84.204.47099: Flags [P.], seq 3873758753:3873758797, ack 4068113581, win 329, options [nop,nop,TS val 2464397828 ecr 1033916508], length 44
16:35:14.549568 IP lamp-s-1vcpu-1gb-tor1-01.ssh > 198.96.84.204.47099: Flags [P.], seq 44:152, ack 1, win 329, options [nop,nop,TS val 2464397828 ecr 1033916508], length 108
16:35:14.549615 IP lamp-s-1vcpu-1gb-tor1-01.ssh > 198.96.84.204.47099: Flags [P.], seq 152:188, ack 1, win 329, options [nop,nop,TS val 2464397828 ecr 1033916508], length 36
16:35:14.576497 IP 198.96.84.204.47099 > lamp-s-1vcpu-1gb-tor1-01.ssh: Flags [.], ack 0, win 3895, options [nop,nop,TS val 1033916527 ecr 2464397823], length 0
16:35:14.576542 IP 198.96.84.204.47099 > lamp-s-1vcpu-1gb-tor1-01.ssh: Flags [.], ack 44, win 3894, options [nop,nop,TS val 1033916533 ecr 2464397828], length 0
16:35:14.576550 IP 198.96.84.204.47099 > lamp-s-1vcpu-1gb-tor1-01.ssh: Flags [.], ack 152, win 3893, options [nop,nop,TS val 1033916533 ecr 2464397828], length 0
16:35:14.576555 IP 198.96.84.204.47099 > lamp-s-1vcpu-1gb-tor1-01.ssh: Flags [.], ack 188, win 3892, options [nop,nop,TS val 1033916533 ecr 2464397828], length 0
16:35:15.126610 IP 218.92.0.211.30756 > lamp-s-1vcpu-1gb-tor1-01.ssh: Flags [S], seq 3374725002, win 29200, options [mss 1460,sackOK,TS val 313573814 ecr 0,nop,wscale 7], length 0
16:35:15.126660 IP lamp-s-1vcpu-1gb-tor1-01.ssh > 218.92.0.211.30756: Flags [S.], seq 3064508943, ack 3374725003, win 28960, options [mss 1460,sackOK,TS val 4157332214 ecr 313573063,nop,wscale 7], length 0
16:35:16.316373 IP lamp-s-1vcpu-1gb-tor1-01.ssh > 218.92.0.211.47757: Flags [S.], seq 1993452441, ack 2882916629, win 28960, options [mss 1460,sackOK,TS val 4157333404 ecr 313571812,nop,wscale 7], length 0
16:35:17.120900 IP 218.92.0.211.14441 > lamp-s-1vcpu-1gb-tor1-01.ssh: Flags [S], seq 494708387, win 29200, options [mss 1460,sackOK,TS val 313574314 ecr 0,nop,wscale 7], length 0
16:35:17.120970 IP lamp-s-1vcpu-1gb-tor1-01.ssh > 218.92.0.211.14441: Flags [S.], seq 1347307874, ack 494708388, win 28960, options [mss 1460,sackOK,TS val 4157334208 ecr 313574314,nop,wscale 7], length 0
16:35:17.148382 IP lamp-s-1vcpu-1gb-tor1-01.ssh > 218.92.0.211.30756: Flags [S.], seq 3064508943, ack 3374725003, win 28960, options [mss 1460,sackOK,TS val 4157334236 ecr 313573063,nop,wscale 7], length 0
16:35:18.120741 IP 218.92.0.211.14441 > lamp-s-1vcpu-1gb-tor1-01.ssh: Flags [S], seq 494708387, win 29200, options [mss 1460,sackOK,TS val 313574564 ecr 0,nop,wscale 7], length 0
16:35:18.120807 IP lamp-s-1vcpu-1gb-tor1-01.ssh > 218.92.0.211.14441: Flags [S.], seq 1347307874, ack 494708388, win 28960, options [mss 1460,sackOK,TS val 4157335208 ecr 313574314,nop,wscale 7], length 0
16:35:19.132353 IP lamp-s-1vcpu-1gb-tor1-01.ssh > 218.92.0.211.14441: Flags [S.], seq 1347307874, ack 494708388, win 28960, options [mss 1460,sackOK,TS val 4157336220 ecr 313574314,nop,wscale 7], length 0
16:35:20.124465 IP 218.92.0.211.14441 > lamp-s-1vcpu-1gb-tor1-01.ssh: Flags [S], seq 494708387, win 29200, options [mss 1460,sackOK,TS val 313575065 ecr 0,nop,wscale 7], length 0
16:35:20.124542 IP lamp-s-1vcpu-1gb-tor1-01.ssh > 218.92.0.211.14441: Flags [S.], seq 1347307874, ack 494708388, win 28960, options [mss 1460,sackOK,TS val 4157337212 ecr 313574314,nop,wscale 7], length 0
16:35:20.870099 IP 178.62.33.138.56878 > lamp-s-1vcpu-1gb-tor1-01.ssh: Flags [S], seq 1735954842, win 29200, options [mss 1460,sackOK,TS val 1434295717 ecr 0,nop,wscale 7], length 0
16:35:20.870156 IP lamp-s-1vcpu-1gb-tor1-01 > 178.62.33.138: ICMP lamp-s-1vcpu-1gb-tor1-01 tcp port ssh unreachable, length 68
16:35:20.943530 IP 212.64.54.49.56766 > lamp-s-1vcpu-1gb-tor1-01.ssh: Flags [FP.], seq 2876304882:2876304934, ack 944437406, win 262, options [nop,nop,TS val 357520896 ecr 3219933099], length 52
16:35:20.943581 IP lamp-s-1vcpu-1gb-tor1-01 > 212.64.54.49: ICMP lamp-s-1vcpu-1gb-tor1-01 tcp port ssh unreachable, length 112
16:35:21.180367 IP lamp-s-1vcpu-1gb-tor1-01.ssh > 218.92.0.211.30756: Flags [S.], seq 3064508943, ack 3374725003, win 28960, options [mss 1460,sackOK,TS val 4157338268 ecr 313573063,nop,wscale 7], length 0
16:35:22.140349 IP lamp-s-1vcpu-1gb-tor1-01.ssh > 218.92.0.211.14441: Flags [S.], seq 1347307874, ack 494708388, win 28960, options [mss 1460,sackOK,TS val 4157339228 ecr 313574314,nop,wscale 7], length 0
16:35:24.508371 IP lamp-s-1vcpu-1gb-tor1-01.ssh > 218.92.0.211.47757: Flags [S.], seq 1993452441, ack 2882916629, win 28960, options [mss 1460,sackOK,TS val 4157341596 ecr 313571812,nop,wscale 7], length 0
16:35:26.300371 IP lamp-s-1vcpu-1gb-tor1-01.ssh > 218.92.0.211.14441: Flags [S.], seq 1347307874, ack 494708388, win 28960, options [mss 1460,sackOK,TS val 4157343388 ecr 313574314,nop,wscale 7], length 0
16:35:29.372368 IP lamp-s-1vcpu-1gb-tor1-01.ssh > 218.92.0.211.30756: Flags [S.], seq 3064508943, ack 3374725003, win 28960, options [mss 1460,sackOK,TS val 4157346460 ecr 313573063,nop,wscale 7], length 0
16:35:31.224106 IP lamp-s-1vcpu-1gb-tor1-01.ssh > 222.186.15.10.48443: Flags [F.], seq 4167897483, ack 4240904921, win 227, options [nop,nop,TS val 4000131072 ecr 3108988], length 0
16:35:31.470614 IP 222.186.15.10.48443 > lamp-s-1vcpu-1gb-tor1-01.ssh: Flags [R], seq 4240904921, win 0, length 0
16:35:32.636837 IP cpe-74-141-132-233.kya.res.rr.com.57694 > lamp-s-1vcpu-1gb-tor1-01.ssh: Flags [S], seq 1842669927, win 64240, options [mss 1460,sackOK,TS val 2035482876 ecr 0,nop,wscale 7], length 0
16:35:32.636920 IP lamp-s-1vcpu-1gb-tor1-01.ssh > cpe-74-141-132-233.kya.res.rr.com.57694: Flags [S.], seq 2459702758, ack 1842669928, win 28960, options [mss 1460,sackOK,TS val 553870754 ecr 2035482876,nop,wscale 7], length 0
16:35:32.680000 IP cpe-74-141-132-233.kya.res.rr.com.57694 > lamp-s-1vcpu-1gb-tor1-01.ssh: Flags [.], ack 1, win 502, options [nop,nop,TS val 2035482924 ecr 553870754], length 0
16:35:32.690021 IP lamp-s-1vcpu-1gb-tor1-01.ssh > cpe-74-141-132-233.kya.res.rr.com.57694: Flags [P.], seq 1:42, ack 1, win 227, options [nop,nop,TS val 553870807 ecr 2035482924], length 41
16:35:32.732602 IP cpe-74-141-132-233.kya.res.rr.com.57694 > lamp-s-1vcpu-1gb-tor1-01.ssh: Flags [.], ack 42, win 502, options [nop,nop,TS val 2035482976 ecr 553870807], length 0
16:35:32.732653 IP cpe-74-141-132-233.kya.res.rr.com.57694 > lamp-s-1vcpu-1gb-tor1-01.ssh: Flags [P.], seq 1:22, ack 42, win 502, options [nop,nop,TS val 2035482976 ecr 553870807], length 21
16:35:32.732677 IP lamp-s-1vcpu-1gb-tor1-01.ssh > cpe-74-141-132-233.kya.res.rr.com.57694: Flags [.], ack 22, win 227, options [nop,nop,TS val 553870850 ecr 2035482976], length 0
16:35:32.734088 IP lamp-s-1vcpu-1gb-tor1-01.ssh > cpe-74-141-132-233.kya.res.rr.com.57694: Flags [P.], seq 42:1122, ack 22, win 227, options [nop,nop,TS val 553870851 ecr 2035482976], length 1080
16:35:32.776956 IP cpe-74-141-132-233.kya.res.rr.com.57694 > lamp-s-1vcpu-1gb-tor1-01.ssh: Flags [P.], seq 22:462, ack 1122, win 501, options [nop,nop,TS val 2035483020 ecr 553870851], length 440
16:35:32.820369 IP lamp-s-1vcpu-1gb-tor1-01.ssh > cpe-74-141-132-233.kya.res.rr.com.57694: Flags [.], ack 462, win 235, options [nop,nop,TS val 553870938 ecr 2035483020], length 0
16:35:32.859449 IP cpe-74-141-132-233.kya.res.rr.com.57694 > lamp-s-1vcpu-1gb-tor1-01.ssh: Flags [P.], seq 462:510, ack 1122, win 501, options [nop,nop,TS val 2035483105 ecr 553870938], length 48
16:35:32.859500 IP lamp-s-1vcpu-1gb-tor1-01.ssh > cpe-74-141-132-233.kya.res.rr.com.57694: Flags [.], ack 510, win 235, options [nop,nop,TS val 553870977 ecr 2035483105], length 0
16:35:32.869240 IP lamp-s-1vcpu-1gb-tor1-01.ssh > cpe-74-141-132-233.kya.res.rr.com.57694: Flags [P.], seq 1122:1402, ack 510, win 235, options [nop,nop,TS val 553870987 ecr 2035483105], length 280
16:35:32.933829 IP cpe-74-141-132-233.kya.res.rr.com.57694 > lamp-s-1vcpu-1gb-tor1-01.ssh: Flags [P.], seq 510:526, ack 1402, win 501, options [nop,nop,TS val 2035483179 ecr 553870987], length 16
16:35:32.976365 IP lamp-s-1vcpu-1gb-tor1-01.ssh > cpe-74-141-132-233.kya.res.rr.com.57694: Flags [.], ack 526, win 235, options [nop,nop,TS val 553871094 ecr 2035483179], length 0
16:35:33.013394 IP cpe-74-141-132-233.kya.res.rr.com.57694 > lamp-s-1vcpu-1gb-tor1-01.ssh: Flags [P.], seq 526:578, ack 1402, win 501, options [nop,nop,TS val 2035483262 ecr 553871094], length 52
16:35:33.013447 IP lamp-s-1vcpu-1gb-tor1-01.ssh > cpe-74-141-132-233.kya.res.rr.com.57694: Flags [.], ack 578, win 235, options [nop,nop,TS val 553871131 ecr 2035483262], length 0
16:35:33.013632 IP lamp-s-1vcpu-1gb-tor1-01.ssh > cpe-74-141-132-233.kya.res.rr.com.57694: Flags [P.], seq 1402:1454, ack 578, win 235, options [nop,nop,TS val 553871131 ecr 2035483262], length 52
16:35:33.049991 IP cpe-74-141-132-233.kya.res.rr.com.57694 > lamp-s-1vcpu-1gb-tor1-01.ssh: Flags [P.], seq 578:662, ack 1454, win 501, options [nop,nop,TS val 2035483299 ecr 553871131], length 84
16:35:33.100355 IP lamp-s-1vcpu-1gb-tor1-01.ssh > cpe-74-141-132-233.kya.res.rr.com.57694: Flags [.], ack 662, win 235, options [nop,nop,TS val 553871218 ecr 2035483299], length 0
16:35:33.883133 IP nsg-static-030.154.72.182.airtel.in.60487 > lamp-s-1vcpu-1gb-tor1-01.ssh: Flags [S], seq 158071461, win 14600, options [mss 1460,sackOK,nop,nop,nop,nop,nop,nop,nop,nop,nop,nop,nop,wscale 7], length 0
16:35:33.883189 IP lamp-s-1vcpu-1gb-tor1-01 > nsg-static-030.154.72.182.airtel.in: ICMP lamp-s-1vcpu-1gb-tor1-01 tcp port ssh unreachable, length 68
16:35:34.492361 IP lamp-s-1vcpu-1gb-tor1-01.ssh > 218.92.0.211.14441: Flags [S.], seq 1347307874, ack 494708388, win 28960, options [mss 1460,sackOK,TS val 4157351580 ecr 313574314,nop,wscale 7], length 0
16:35:34.895666 IP nsg-static-030.154.72.182.airtel.in.60487 > lamp-s-1vcpu-1gb-tor1-01.ssh: Flags [S], seq 158071461, win 14600, options [mss 1460,sackOK,TS val 3520552920 ecr 0,nop,wscale 7], length 0
16:35:34.895728 IP lamp-s-1vcpu-1gb-tor1-01 > nsg-static-030.154.72.182.airtel.in: ICMP lamp-s-1vcpu-1gb-tor1-01 tcp port ssh unreachable, length 68
^C16:35:35.004371 IP lamp-s-1vcpu-1gb-tor1-01.ssh > 106.12.177.27.38482: Flags [P.], seq 2775410357:2775410425, ack 798447031, win 235, options [nop,nop,TS val 3086956310 ecr 1155928469], length 68
