16:38:44.790280 IP lamp-s-1vcpu-1gb-tor1-01.ssh > 198.96.84.204.47099: Flags [P.], seq 1369696:1369916, ack 829, win 329, options [nop,nop,TS val 2464608069 ecr 1034126064], length 220
16:38:44.790352 IP lamp-s-1vcpu-1gb-tor1-01.ssh > 198.96.84.204.47099: Flags [P.], seq 1369916:1370136, ack 829, win 329, options [nop,nop,TS val 2464608069 ecr 1034126064], length 220
16:38:44.790422 IP lamp-s-1vcpu-1gb-tor1-01.ssh > 198.96.84.204.47099: Flags [P.], seq 1370136:1370356, ack 829, win 329, options [nop,nop,TS val 2464608069 ecr 1034126064], length 220
16:38:44.790489 IP lamp-s-1vcpu-1gb-tor1-01.ssh > 198.96.84.204.47099: Flags [P.], seq 1370356:1370576, ack 829, win 329, options [nop,nop,TS val 2464608069 ecr 1034126064], length 220
16:38:44.790557 IP lamp-s-1vcpu-1gb-tor1-01.ssh > 198.96.84.204.47099: Flags [P.], seq 1370576:1370796, ack 829, win 329, options [nop,nop,TS val 2464608069 ecr 1034126064], length 220
16:38:44.790635 IP lamp-s-1vcpu-1gb-tor1-01.ssh > 198.96.84.204.47099: Flags [P.], seq 1370796:1371016, ack 829, win 329, options [nop,nop,TS val 2464608070 ecr 1034126064], length 220
16:38:44.790709 IP lamp-s-1vcpu-1gb-tor1-01.ssh > 198.96.84.204.47099: Flags [P.], seq 1371016:1371236, ack 829, win 329, options [nop,nop,TS val 2464608070 ecr 1034126064], length 220
16:38:44.790781 IP lamp-s-1vcpu-1gb-tor1-01.ssh > 198.96.84.204.47099: Flags [P.], seq 1371236:1371456, ack 829, win 329, options [nop,nop,TS val 2464608070 ecr 1034126064], length 220
16:38:44.790852 IP lamp-s-1vcpu-1gb-tor1-01.ssh > 198.96.84.204.47099: Flags [P.], seq 1371456:1371676, ack 829, win 329, options [nop,nop,TS val 2464608070 ecr 1034126064], length 220
16:38:44.790920 IP lamp-s-1vcpu-1gb-tor1-01.ssh > 198.96.84.204.47099: Flags [P.], seq 1371676:1371896, ack 829, win 329, options [nop,nop,TS val 2464608070 ecr 1034126064], length 220
16:38:44.790988 IP lamp-s-1vcpu-1gb-tor1-01.ssh > 198.96.84.204.47099: Flags [P.], seq 1371896:1372116, ack 829, win 329, options [nop,nop,TS val 2464608070 ecr 1034126064], length 220
16:38:44.791055 IP lamp-s-1vcpu-1gb-tor1-01.ssh > 198.96.84.204.47099: Flags [P.], seq 1372116:1372336, ack 829, win 329, options [nop,nop,TS val 2464608070 ecr 1034126064], length 220
16:38:44.791136 IP lamp-s-1vcpu-1gb-tor1-01.ssh > 198.96.84.204.47099: Flags [P.], seq 1372336:1372556, ack 829, win 329, options [nop,nop,TS val 2464608070 ecr 1034126064], length 220
16:38:44.791207 IP lamp-s-1vcpu-1gb-tor1-01.ssh > 198.96.84.204.47099: Flags [P.], seq 1372556:1372776, ack 829, win 329, options [nop,nop,TS val 2464608070 ecr 1034126064], length 220
16:38:44.791279 IP lamp-s-1vcpu-1gb-tor1-01.ssh > 198.96.84.204.47099: Flags [P.], seq 1372776:1372996, ack 829, win 329, options [nop,nop,TS val 2464608070 ecr 1034126064], length 220
16:38:44.791346 IP lamp-s-1vcpu-1gb-tor1-01.ssh > 198.96.84.204.47099: Flags [P.], seq 1372996:1373216, ack 829, win 329, options [nop,nop,TS val 2464608070 ecr 1034126064], length 220
16:38:44.791413 IP lamp-s-1vcpu-1gb-tor1-01.ssh > 198.96.84.204.47099: Flags [P.], seq 1373216:1373436, ack 829, win 329, options [nop,nop,TS val 2464608070 ecr 1034126064], length 220
16:38:44.791490 IP lamp-s-1vcpu-1gb-tor1-01.ssh > 198.96.84.204.47099: Flags [P.], seq 1373436:1373656, ack 829, win 329, options [nop,nop,TS val 2464608070 ecr 1034126064], length 220
16:38:44.791567 IP lamp-s-1vcpu-1gb-tor1-01.ssh > 198.96.84.204.47099: Flags [P.], seq 1373656:1373876, ack 829, win 329, options [nop,nop,TS val 2464608070 ecr 1034126064], length 220
16:38:44.791639 IP lamp-s-1vcpu-1gb-tor1-01.ssh > 198.96.84.204.47099: Flags [P.], seq 1373876:1374096, ack 829, win 329, options [nop,nop,TS val 2464608071 ecr 1034126064], length 220
16:38:44.791710 IP lamp-s-1vcpu-1gb-tor1-01.ssh > 198.96.84.204.47099: Flags [P.], seq 1374096:1374316, ack 829, win 329, options [nop,nop,TS val 2464608071 ecr 1034126064], length 220
16:38:44.791779 IP lamp-s-1vcpu-1gb-tor1-01.ssh > 198.96.84.204.47099: Flags [P.], seq 1374316:1374536, ack 829, win 329, options [nop,nop,TS val 2464608071 ecr 1034126064], length 220
16:38:44.791848 IP lamp-s-1vcpu-1gb-tor1-01.ssh > 198.96.84.204.47099: Flags [P.], seq 1374536:1374756, ack 829, win 329, options [nop,nop,TS val 2464608071 ecr 1034126064], length 220
16:38:44.791916 IP lamp-s-1vcpu-1gb-tor1-01.ssh > 198.96.84.204.47099: Flags [P.], seq 1374756:1374976, ack 829, win 329, options [nop,nop,TS val 2464608071 ecr 1034126064], length 220
16:38:44.791984 IP lamp-s-1vcpu-1gb-tor1-01.ssh > 198.96.84.204.47099: Flags [P.], seq 1374976:1375196, ack 829, win 329, options [nop,nop,TS val 2464608071 ecr 1034126064], length 220
16:38:44.792051 IP lamp-s-1vcpu-1gb-tor1-01.ssh > 198.96.84.204.47099: Flags [P.], seq 1375196:1375416, ack 829, win 329, options [nop,nop,TS val 2464608071 ecr 1034126064], length 220
16:38:44.792118 IP lamp-s-1vcpu-1gb-tor1-01.ssh > 198.96.84.204.47099: Flags [P.], seq 1375416:1375636, ack 829, win 329, options [nop,nop,TS val 2464608071 ecr 1034126064], length 220
16:38:44.792195 IP lamp-s-1vcpu-1gb-tor1-01.ssh > 198.96.84.204.47099: Flags [P.], seq 1375636:1375856, ack 829, win 329, options [nop,nop,TS val 2464608071 ecr 1034126064], length 220
16:38:44.792262 IP lamp-s-1vcpu-1gb-tor1-01.ssh > 198.96.84.204.47099: Flags [P.], seq 1375856:1376076, ack 829, win 329, options [nop,nop,TS val 2464608071 ecr 1034126064], length 220
16:38:44.792366 IP lamp-s-1vcpu-1gb-tor1-01.ssh > 198.96.84.204.47099: Flags [P.], seq 1376076:1376296, ack 829, win 329, options [nop,nop,TS val 2464608071 ecr 1034126064], length 220
16:38:44.792447 IP lamp-s-1vcpu-1gb-tor1-01.ssh > 198.96.84.204.47099: Flags [P.], seq 1376296:1376516, ack 829, win 329, options [nop,nop,TS val 2464608071 ecr 1034126064], length 220
16:38:44.792522 IP lamp-s-1vcpu-1gb-tor1-01.ssh > 198.96.84.204.47099: Flags [P.], seq 1376516:1376736, ack 829, win 329, options [nop,nop,TS val 2464608071 ecr 1034126064], length 220
16:38:44.792594 IP lamp-s-1vcpu-1gb-tor1-01.ssh > 198.96.84.204.47099: Flags [P.], seq 1376736:1376956, ack 829, win 329, options [nop,nop,TS val 2464608072 ecr 1034126064], length 220
16:38:44.792663 IP lamp-s-1vcpu-1gb-tor1-01.ssh > 198.96.84.204.47099: Flags [P.], seq 1376956:1377176, ack 829, win 329, options [nop,nop,TS val 2464608072 ecr 1034126064], length 220
16:38:44.792736 IP lamp-s-1vcpu-1gb-tor1-01.ssh > 198.96.84.204.47099: Flags [P.], seq 1377176:1377396, ack 829, win 329, options [nop,nop,TS val 2464608072 ecr 1034126064], length 220
16:38:44.792806 IP lamp-s-1vcpu-1gb-tor1-01.ssh > 198.96.84.204.47099: Flags [P.], seq 1377396:1377616, ack 829, win 329, options [nop,nop,TS val 2464608072 ecr 1034126064], length 220
16:38:44.792874 IP lamp-s-1vcpu-1gb-tor1-01.ssh > 198.96.84.204.47099: Flags [P.], seq 1377616:1377836, ack 829, win 329, options [nop,nop,TS val 2464608072 ecr 1034126064], length 220
16:38:44.792943 IP lamp-s-1vcpu-1gb-tor1-01.ssh > 198.96.84.204.47099: Flags [P.], seq 1377836:1378056, ack 829, win 329, options [nop,nop,TS val 2464608072 ecr 1034126064], length 220
16:38:44.793015 IP lamp-s-1vcpu-1gb-tor1-01.ssh > 198.96.84.204.47099: Flags [P.], seq 1378056:1378276, ack 829, win 329, options [nop,nop,TS val 2464608072 ecr 1034126064], length 220
16:38:44.793107 IP lamp-s-1vcpu-1gb-tor1-01.ssh > 198.96.84.204.47099: Flags [P.], seq 1378276:1378496, ack 829, win 329, options [nop,nop,TS val 2464608072 ecr 1034126064], length 220
16:38:44.793183 IP lamp-s-1vcpu-1gb-tor1-01.ssh > 198.96.84.204.47099: Flags [P.], seq 1378496:1378716, ack 829, win 329, options [nop,nop,TS val 2464608072 ecr 1034126064], length 220
16:38:44.793259 IP lamp-s-1vcpu-1gb-tor1-01.ssh > 198.96.84.204.47099: Flags [P.], seq 1378716:1378936, ack 829, win 329, options [nop,nop,TS val 2464608072 ecr 1034126064], length 220
16:38:44.793332 IP lamp-s-1vcpu-1gb-tor1-01.ssh > 198.96.84.204.47099: Flags [P.], seq 1378936:1379156, ack 829, win 329, options [nop,nop,TS val 2464608072 ecr 1034126064], length 220
16:38:44.793408 IP lamp-s-1vcpu-1gb-tor1-01.ssh > 198.96.84.204.47099: Flags [P.], seq 1379156:1379376, ack 829, win 329, options [nop,nop,TS val 2464608072 ecr 1034126064], length 220
16:38:44.793479 IP lamp-s-1vcpu-1gb-tor1-01.ssh > 198.96.84.204.47099: Flags [P.], seq 1379376:1379596, ack 829, win 329, options [nop,nop,TS val 2464608072 ecr 1034126064], length 220
16:38:44.793560 IP lamp-s-1vcpu-1gb-tor1-01.ssh > 198.96.84.204.47099: Flags [P.], seq 1379596:1379816, ack 829, win 329, options [nop,nop,TS val 2464608072 ecr 1034126064], length 220
16:38:44.793640 IP lamp-s-1vcpu-1gb-tor1-01.ssh > 198.96.84.204.47099: Flags [P.], seq 1379816:1380036, ack 829, win 329, options [nop,nop,TS val 2464608073 ecr 1034126064], length 220
16:38:44.793721 IP lamp-s-1vcpu-1gb-tor1-01.ssh > 198.96.84.204.47099: Flags [P.], seq 1380036:1380256, ack 829, win 329, options [nop,nop,TS val 2464608073 ecr 1034126064], length 220
16:38:44.793801 IP lamp-s-1vcpu-1gb-tor1-01.ssh > 198.96.84.204.47099: Flags [P.], seq 1380256:1380476, ack 829, win 329, options [nop,nop,TS val 2464608073 ecr 1034126064], length 220
16:38:44.793875 IP lamp-s-1vcpu-1gb-tor1-01.ssh > 198.96.84.204.47099: Flags [P.], seq 1380476:1380696, ack 829, win 329, options [nop,nop,TS val 2464608073 ecr 1034126064], length 220
16:38:44.793946 IP lamp-s-1vcpu-1gb-tor1-01.ssh > 198.96.84.204.47099: Flags [P.], seq 1380696:1380916, ack 829, win 329, options [nop,nop,TS val 2464608073 ecr 1034126064], length 220
16:38:44.794025 IP lamp-s-1vcpu-1gb-tor1-01.ssh > 198.96.84.204.47099: Flags [P.], seq 1380916:1381136, ack 829, win 329, options [nop,nop,TS val 2464608073 ecr 1034126064], length 220
16:38:44.800645 IP 198.96.84.204.47099 > lamp-s-1vcpu-1gb-tor1-01.ssh: Flags [.], ack 1365120, win 3832, options [nop,nop,TS val 1034126069 ecr 2464608067], length 0
16:38:44.800706 IP lamp-s-1vcpu-1gb-tor1-01.ssh > 198.96.84.204.47099: Flags [P.], seq 1381136:1381356, ack 829, win 329, options [nop,nop,TS val 2464608080 ecr 1034126069], length 220
16:38:44.800732 IP 198.96.84.204.47099 > lamp-s-1vcpu-1gb-tor1-01.ssh: Flags [.], ack 1365348, win 3828, options [nop,nop,TS val 1034126069 ecr 2464608068], length 0
16:38:44.800739 IP 198.96.84.204.47099 > lamp-s-1vcpu-1gb-tor1-01.ssh: Flags [.], ack 1365568, win 3825, options [nop,nop,TS val 1034126069 ecr 2464608068], length 0
16:38:44.800744 IP 198.96.84.204.47099 > lamp-s-1vcpu-1gb-tor1-01.ssh: Flags [.], ack 1365568, win 3895, options [nop,nop,TS val 1034126069 ecr 2464608068], length 0
16:38:44.800758 IP 198.96.84.204.47099 > lamp-s-1vcpu-1gb-tor1-01.ssh: Flags [.], ack 1365788, win 3892, options [nop,nop,TS val 1034126069 ecr 2464608068], length 0
16:38:44.800768 IP 198.96.84.204.47099 > lamp-s-1vcpu-1gb-tor1-01.ssh: Flags [.], ack 1366008, win 3888, options [nop,nop,TS val 1034126069 ecr 2464608068], length 0
16:38:44.800979 IP 198.96.84.204.47099 > lamp-s-1vcpu-1gb-tor1-01.ssh: Flags [.], ack 1369476, win 3834, options [nop,nop,TS val 1034126069 ecr 2464608069], length 0
16:38:44.800991 IP 198.96.84.204.47099 > lamp-s-1vcpu-1gb-tor1-01.ssh: Flags [.], ack 1369696, win 3831, options [nop,nop,TS val 1034126069 ecr 2464608069], length 0
16:38:44.801144 IP 198.96.84.204.47099 > lamp-s-1vcpu-1gb-tor1-01.ssh: Flags [.], ack 1373436, win 3875, options [nop,nop,TS val 1034126072 ecr 2464608070], length 0
16:38:44.801151 IP 198.96.84.204.47099 > lamp-s-1vcpu-1gb-tor1-01.ssh: Flags [.], ack 1373656, win 3871, options [nop,nop,TS val 1034126072 ecr 2464608070], length 0
16:38:44.801156 IP 198.96.84.204.47099 > lamp-s-1vcpu-1gb-tor1-01.ssh: Flags [.], ack 1373876, win 3868, options [nop,nop,TS val 1034126072 ecr 2464608070], length 0
16:38:44.801162 IP 198.96.84.204.47099 > lamp-s-1vcpu-1gb-tor1-01.ssh: Flags [.], ack 1374096, win 3864, options [nop,nop,TS val 1034126072 ecr 2464608071], length 0
16:38:44.801269 IP 198.96.84.204.47099 > lamp-s-1vcpu-1gb-tor1-01.ssh: Flags [.], ack 1377836, win 3875, options [nop,nop,TS val 1034126072 ecr 2464608072], length 0
16:38:44.801481 IP lamp-s-1vcpu-1gb-tor1-01.ssh > 198.96.84.204.47099: Flags [P.], seq 1381356:1383752, ack 829, win 329, options [nop,nop,TS val 2464608080 ecr 1034126072], length 2396
16:38:44.801572 IP lamp-s-1vcpu-1gb-tor1-01.ssh > 198.96.84.204.47099: Flags [P.], seq 1383752:1383980, ack 829, win 329, options [nop,nop,TS val 2464608081 ecr 1034126072], length 228
16:38:44.801647 IP lamp-s-1vcpu-1gb-tor1-01.ssh > 198.96.84.204.47099: Flags [P.], seq 1383980:1384200, ack 829, win 329, options [nop,nop,TS val 2464608081 ecr 1034126072], length 220
16:38:44.801720 IP lamp-s-1vcpu-1gb-tor1-01.ssh > 198.96.84.204.47099: Flags [P.], seq 1384200:1384420, ack 829, win 329, options [nop,nop,TS val 2464608081 ecr 1034126072], length 220
16:38:44.801791 IP lamp-s-1vcpu-1gb-tor1-01.ssh > 198.96.84.204.47099: Flags [P.], seq 1384420:1384640, ack 829, win 329, options [nop,nop,TS val 2464608081 ecr 1034126072], length 220
16:38:44.801861 IP lamp-s-1vcpu-1gb-tor1-01.ssh > 198.96.84.204.47099: Flags [P.], seq 1384640:1384860, ack 829, win 329, options [nop,nop,TS val 2464608081 ecr 1034126072], length 220
16:38:44.801943 IP lamp-s-1vcpu-1gb-tor1-01.ssh > 198.96.84.204.47099: Flags [P.], seq 1384860:1385080, ack 829, win 329, options [nop,nop,TS val 2464608081 ecr 1034126072], length 220
16:38:44.802013 IP lamp-s-1vcpu-1gb-tor1-01.ssh > 198.96.84.204.47099: Flags [P.], seq 1385080:1385300, ack 829, win 329, options [nop,nop,TS val 2464608081 ecr 1034126072], length 220
16:38:44.802106 IP lamp-s-1vcpu-1gb-tor1-01.ssh > 198.96.84.204.47099: Flags [P.], seq 1385300:1385520, ack 829, win 329, options [nop,nop,TS val 2464608081 ecr 1034126072], length 220
16:38:44.802180 IP lamp-s-1vcpu-1gb-tor1-01.ssh > 198.96.84.204.47099: Flags [P.], seq 1385520:1385740, ack 829, win 329, options [nop,nop,TS val 2464608081 ecr 1034126072], length 220
16:38:44.802252 IP lamp-s-1vcpu-1gb-tor1-01.ssh > 198.96.84.204.47099: Flags [P.], seq 1385740:1385960, ack 829, win 329, options [nop,nop,TS val 2464608081 ecr 1034126072], length 220
16:38:44.802333 IP lamp-s-1vcpu-1gb-tor1-01.ssh > 198.96.84.204.47099: Flags [P.], seq 1385960:1386180, ack 829, win 329, options [nop,nop,TS val 2464608081 ecr 1034126072], length 220
16:38:44.802411 IP lamp-s-1vcpu-1gb-tor1-01.ssh > 198.96.84.204.47099: Flags [P.], seq 1386180:1386400, ack 829, win 329, options [nop,nop,TS val 2464608081 ecr 1034126072], length 220
16:38:44.802488 IP lamp-s-1vcpu-1gb-tor1-01.ssh > 198.96.84.204.47099: Flags [P.], seq 1386400:1386620, ack 829, win 329, options [nop,nop,TS val 2464608081 ecr 1034126072], length 220
16:38:44.802563 IP lamp-s-1vcpu-1gb-tor1-01.ssh > 198.96.84.204.47099: Flags [P.], seq 1386620:1386840, ack 829, win 329, options [nop,nop,TS val 2464608081 ecr 1034126072], length 220
16:38:44.802635 IP lamp-s-1vcpu-1gb-tor1-01.ssh > 198.96.84.204.47099: Flags [P.], seq 1386840:1387060, ack 829, win 329, options [nop,nop,TS val 2464608082 ecr 1034126072], length 220
16:38:44.802707 IP lamp-s-1vcpu-1gb-tor1-01.ssh > 198.96.84.204.47099: Flags [P.], seq 1387060:1387280, ack 829, win 329, options [nop,nop,TS val 2464608082 ecr 1034126072], length 220
16:38:44.802776 IP lamp-s-1vcpu-1gb-tor1-01.ssh > 198.96.84.204.47099: Flags [P.], seq 1387280:1387500, ack 829, win 329, options [nop,nop,TS val 2464608082 ecr 1034126072], length 220
16:38:44.802846 IP lamp-s-1vcpu-1gb-tor1-01.ssh > 198.96.84.204.47099: Flags [P.], seq 1387500:1387720, ack 829, win 329, options [nop,nop,TS val 2464608082 ecr 1034126072], length 220
16:38:44.802920 IP lamp-s-1vcpu-1gb-tor1-01.ssh > 198.96.84.204.47099: Flags [P.], seq 1387720:1387940, ack 829, win 329, options [nop,nop,TS val 2464608082 ecr 1034126072], length 220
16:38:44.803001 IP lamp-s-1vcpu-1gb-tor1-01.ssh > 198.96.84.204.47099: Flags [P.], seq 1387940:1388160, ack 829, win 329, options [nop,nop,TS val 2464608082 ecr 1034126072], length 220
16:38:44.803071 IP lamp-s-1vcpu-1gb-tor1-01.ssh > 198.96.84.204.47099: Flags [P.], seq 1388160:1388380, ack 829, win 329, options [nop,nop,TS val 2464608082 ecr 1034126072], length 220
16:38:44.803141 IP lamp-s-1vcpu-1gb-tor1-01.ssh > 198.96.84.204.47099: Flags [P.], seq 1388380:1388600, ack 829, win 329, options [nop,nop,TS val 2464608082 ecr 1034126072], length 220
16:38:44.803211 IP lamp-s-1vcpu-1gb-tor1-01.ssh > 198.96.84.204.47099: Flags [P.], seq 1388600:1388820, ack 829, win 329, options [nop,nop,TS val 2464608082 ecr 1034126072], length 220
16:38:44.803303 IP lamp-s-1vcpu-1gb-tor1-01.ssh > 198.96.84.204.47099: Flags [P.], seq 1388820:1389040, ack 829, win 329, options [nop,nop,TS val 2464608082 ecr 1034126072], length 220
16:38:44.803383 IP lamp-s-1vcpu-1gb-tor1-01.ssh > 198.96.84.204.47099: Flags [P.], seq 1389040:1389260, ack 829, win 329, options [nop,nop,TS val 2464608082 ecr 1034126072], length 220
16:38:44.803458 IP lamp-s-1vcpu-1gb-tor1-01.ssh > 198.96.84.204.47099: Flags [P.], seq 1389260:1389480, ack 829, win 329, options [nop,nop,TS val 2464608082 ecr 1034126072], length 220
16:38:44.803531 IP lamp-s-1vcpu-1gb-tor1-01.ssh > 198.96.84.204.47099: Flags [P.], seq 1389480:1389700, ack 829, win 329, options [nop,nop,TS val 2464608082 ecr 1034126072], length 220
16:38:44.803607 IP lamp-s-1vcpu-1gb-tor1-01.ssh > 198.96.84.204.47099: Flags [P.], seq 1389700:1389920, ack 829, win 329, options [nop,nop,TS val 2464608083 ecr 1034126072], length 220
16:38:44.803678 IP lamp-s-1vcpu-1gb-tor1-01.ssh > 198.96.84.204.47099: Flags [P.], seq 1389920:1390140, ack 829, win 329, options [nop,nop,TS val 2464608083 ecr 1034126072], length 220
16:38:44.803749 IP lamp-s-1vcpu-1gb-tor1-01.ssh > 198.96.84.204.47099: Flags [P.], seq 1390140:1390360, ack 829, win 329, options [nop,nop,TS val 2464608083 ecr 1034126072], length 220
16:38:44.803817 IP lamp-s-1vcpu-1gb-tor1-01.ssh > 198.96.84.204.47099: Flags [P.], seq 1390360:1390580, ack 829, win 329, options [nop,nop,TS val 2464608083 ecr 1034126072], length 220
16:38:44.803888 IP lamp-s-1vcpu-1gb-tor1-01.ssh > 198.96.84.204.47099: Flags [P.], seq 1390580:1390800, ack 829, win 329, options [nop,nop,TS val 2464608083 ecr 1034126072], length 220
16:38:44.803956 IP lamp-s-1vcpu-1gb-tor1-01.ssh > 198.96.84.204.47099: Flags [P.], seq 1390800:1391020, ack 829, win 329, options [nop,nop,TS val 2464608083 ecr 1034126072], length 220
16:38:44.804028 IP lamp-s-1vcpu-1gb-tor1-01.ssh > 198.96.84.204.47099: Flags [P.], seq 1391020:1391240, ack 829, win 329, options [nop,nop,TS val 2464608083 ecr 1034126072], length 220
16:38:44.804111 IP lamp-s-1vcpu-1gb-tor1-01.ssh > 198.96.84.204.47099: Flags [P.], seq 1391240:1391460, ack 829, win 329, options [nop,nop,TS val 2464608083 ecr 1034126072], length 220
16:38:44.804186 IP lamp-s-1vcpu-1gb-tor1-01.ssh > 198.96.84.204.47099: Flags [P.], seq 1391460:1391680, ack 829, win 329, options [nop,nop,TS val 2464608083 ecr 1034126072], length 220
16:38:44.804291 IP lamp-s-1vcpu-1gb-tor1-01.ssh > 198.96.84.204.47099: Flags [P.], seq 1391680:1391900, ack 829, win 329, options [nop,nop,TS val 2464608083 ecr 1034126072], length 220
16:38:44.804374 IP lamp-s-1vcpu-1gb-tor1-01.ssh > 198.96.84.204.47099: Flags [P.], seq 1391900:1392120, ack 829, win 329, options [nop,nop,TS val 2464608083 ecr 1034126072], length 220
16:38:44.804447 IP lamp-s-1vcpu-1gb-tor1-01.ssh > 198.96.84.204.47099: Flags [P.], seq 1392120:1392340, ack 829, win 329, options [nop,nop,TS val 2464608083 ecr 1034126072], length 220
16:38:44.804521 IP lamp-s-1vcpu-1gb-tor1-01.ssh > 198.96.84.204.47099: Flags [P.], seq 1392340:1392560, ack 829, win 329, options [nop,nop,TS val 2464608083 ecr 1034126072], length 220
16:38:44.804592 IP lamp-s-1vcpu-1gb-tor1-01.ssh > 198.96.84.204.47099: Flags [P.], seq 1392560:1392780, ack 829, win 329, options [nop,nop,TS val 2464608084 ecr 1034126072], length 220
16:38:44.804663 IP lamp-s-1vcpu-1gb-tor1-01.ssh > 198.96.84.204.47099: Flags [P.], seq 1392780:1393000, ack 829, win 329, options [nop,nop,TS val 2464608084 ecr 1034126072], length 220
16:38:44.804735 IP lamp-s-1vcpu-1gb-tor1-01.ssh > 198.96.84.204.47099: Flags [P.], seq 1393000:1393220, ack 829, win 329, options [nop,nop,TS val 2464608084 ecr 1034126072], length 220
16:38:44.804806 IP lamp-s-1vcpu-1gb-tor1-01.ssh > 198.96.84.204.47099: Flags [P.], seq 1393220:1393440, ack 829, win 329, options [nop,nop,TS val 2464608084 ecr 1034126072], length 220
16:38:44.804875 IP lamp-s-1vcpu-1gb-tor1-01.ssh > 198.96.84.204.47099: Flags [P.], seq 1393440:1393660, ack 829, win 329, options [nop,nop,TS val 2464608084 ecr 1034126072], length 220
16:38:44.804945 IP lamp-s-1vcpu-1gb-tor1-01.ssh > 198.96.84.204.47099: Flags [P.], seq 1393660:1393880, ack 829, win 329, options [nop,nop,TS val 2464608084 ecr 1034126072], length 220
16:38:44.805019 IP lamp-s-1vcpu-1gb-tor1-01.ssh > 198.96.84.204.47099: Flags [P.], seq 1393880:1394100, ack 829, win 329, options [nop,nop,TS val 2464608084 ecr 1034126072], length 220
16:38:44.805096 IP lamp-s-1vcpu-1gb-tor1-01.ssh > 198.96.84.204.47099: Flags [P.], seq 1394100:1394320, ack 829, win 329, options [nop,nop,TS val 2464608084 ecr 1034126072], length 220
16:38:44.805175 IP lamp-s-1vcpu-1gb-tor1-01.ssh > 198.96.84.204.47099: Flags [P.], seq 1394320:1394540, ack 829, win 329, options [nop,nop,TS val 2464608084 ecr 1034126072], length 220
16:38:44.805251 IP lamp-s-1vcpu-1gb-tor1-01.ssh > 198.96.84.204.47099: Flags [P.], seq 1394540:1394760, ack 829, win 329, options [nop,nop,TS val 2464608084 ecr 1034126072], length 220
16:38:44.805327 IP lamp-s-1vcpu-1gb-tor1-01.ssh > 198.96.84.204.47099: Flags [P.], seq 1394760:1394980, ack 829, win 329, options [nop,nop,TS val 2464608084 ecr 1034126072], length 220
16:38:44.805400 IP lamp-s-1vcpu-1gb-tor1-01.ssh > 198.96.84.204.47099: Flags [P.], seq 1394980:1395200, ack 829, win 329, options [nop,nop,TS val 2464608084 ecr 1034126072], length 220
16:38:44.805470 IP lamp-s-1vcpu-1gb-tor1-01.ssh > 198.96.84.204.47099: Flags [P.], seq 1395200:1395420, ack 829, win 329, options [nop,nop,TS val 2464608084 ecr 1034126072], length 220
16:38:44.805542 IP lamp-s-1vcpu-1gb-tor1-01.ssh > 198.96.84.204.47099: Flags [P.], seq 1395420:1395640, ack 829, win 329, options [nop,nop,TS val 2464608084 ecr 1034126072], length 220
16:38:44.805611 IP lamp-s-1vcpu-1gb-tor1-01.ssh > 198.96.84.204.47099: Flags [P.], seq 1395640:1395860, ack 829, win 329, options [nop,nop,TS val 2464608085 ecr 1034126072], length 220
16:38:44.805681 IP lamp-s-1vcpu-1gb-tor1-01.ssh > 198.96.84.204.47099: Flags [P.], seq 1395860:1396080, ack 829, win 329, options [nop,nop,TS val 2464608085 ecr 1034126072], length 220
16:38:44.805755 IP lamp-s-1vcpu-1gb-tor1-01.ssh > 198.96.84.204.47099: Flags [P.], seq 1396080:1396300, ack 829, win 329, options [nop,nop,TS val 2464608085 ecr 1034126072], length 220
16:38:44.805835 IP lamp-s-1vcpu-1gb-tor1-01.ssh > 198.96.84.204.47099: Flags [P.], seq 1396300:1396520, ack 829, win 329, options [nop,nop,TS val 2464608085 ecr 1034126072], length 220
16:38:44.805907 IP lamp-s-1vcpu-1gb-tor1-01.ssh > 198.96.84.204.47099: Flags [P.], seq 1396520:1396740, ack 829, win 329, options [nop,nop,TS val 2464608085 ecr 1034126072], length 220
16:38:44.808797 IP 198.96.84.204.47099 > lamp-s-1vcpu-1gb-tor1-01.ssh: Flags [.], ack 1378276, win 3892, options [nop,nop,TS val 1034126077 ecr 2464608072], length 0
16:38:44.808836 IP lamp-s-1vcpu-1gb-tor1-01.ssh > 198.96.84.204.47099: Flags [P.], seq 1396740:1396960, ack 829, win 329, options [nop,nop,TS val 2464608088 ecr 1034126077], length 220
16:38:44.808853 IP 198.96.84.204.47099 > lamp-s-1vcpu-1gb-tor1-01.ssh: Flags [.], ack 1378496, win 3888, options [nop,nop,TS val 1034126077 ecr 2464608072], length 0
16:38:44.808861 IP 198.96.84.204.47099 > lamp-s-1vcpu-1gb-tor1-01.ssh: Flags [.], ack 1378716, win 3885, options [nop,nop,TS val 1034126077 ecr 2464608072], length 0
16:38:44.808866 IP 198.96.84.204.47099 > lamp-s-1vcpu-1gb-tor1-01.ssh: Flags [.], ack 1378936, win 3892, options [nop,nop,TS val 1034126077 ecr 2464608072], length 0
16:38:44.808872 IP 198.96.84.204.47099 > lamp-s-1vcpu-1gb-tor1-01.ssh: Flags [.], ack 1379156, win 3888, options [nop,nop,TS val 1034126077 ecr 2464608072], length 0
16:38:44.808877 IP 198.96.84.204.47099 > lamp-s-1vcpu-1gb-tor1-01.ssh: Flags [.], ack 1379376, win 3885, options [nop,nop,TS val 1034126077 ecr 2464608072], length 0