6:39:28.109004 IP lamp-s-1vcpu-1gb-tor1-01.ssh > 198.96.84.204.47099: Flags [P.], seq 2609536:2609764, ack 1585, win 329, options [nop,nop,TS val 2464651388 ecr 1034169111], length 228
16:39:28.109092 IP lamp-s-1vcpu-1gb-tor1-01.ssh > 198.96.84.204.47099: Flags [P.], seq 2609764:2609992, ack 1585, win 329, options [nop,nop,TS val 2464651388 ecr 1034169111], length 228
16:39:28.109188 IP lamp-s-1vcpu-1gb-tor1-01.ssh > 198.96.84.204.47099: Flags [P.], seq 2609992:2610220, ack 1585, win 329, options [nop,nop,TS val 2464651388 ecr 1034169111], length 228
16:39:28.109278 IP lamp-s-1vcpu-1gb-tor1-01.ssh > 198.96.84.204.47099: Flags [P.], seq 2610220:2610448, ack 1585, win 329, options [nop,nop,TS val 2464651388 ecr 1034169111], length 228
16:39:28.109367 IP lamp-s-1vcpu-1gb-tor1-01.ssh > 198.96.84.204.47099: Flags [P.], seq 2610448:2610676, ack 1585, win 329, options [nop,nop,TS val 2464651388 ecr 1034169111], length 228
16:39:28.109460 IP lamp-s-1vcpu-1gb-tor1-01.ssh > 198.96.84.204.47099: Flags [P.], seq 2610676:2610904, ack 1585, win 329, options [nop,nop,TS val 2464651388 ecr 1034169111], length 228
16:39:28.109549 IP lamp-s-1vcpu-1gb-tor1-01.ssh > 198.96.84.204.47099: Flags [P.], seq 2610904:2611132, ack 1585, win 329, options [nop,nop,TS val 2464651389 ecr 1034169111], length 228
16:39:28.109640 IP lamp-s-1vcpu-1gb-tor1-01.ssh > 198.96.84.204.47099: Flags [P.], seq 2611132:2611360, ack 1585, win 329, options [nop,nop,TS val 2464651389 ecr 1034169111], length 228
16:39:28.109732 IP lamp-s-1vcpu-1gb-tor1-01.ssh > 198.96.84.204.47099: Flags [P.], seq 2611360:2611588, ack 1585, win 329, options [nop,nop,TS val 2464651389 ecr 1034169111], length 228
16:39:28.109843 IP lamp-s-1vcpu-1gb-tor1-01.ssh > 198.96.84.204.47099: Flags [P.], seq 2611588:2611816, ack 1585, win 329, options [nop,nop,TS val 2464651389 ecr 1034169111], length 228
16:39:28.109936 IP lamp-s-1vcpu-1gb-tor1-01.ssh > 198.96.84.204.47099: Flags [P.], seq 2611816:2612044, ack 1585, win 329, options [nop,nop,TS val 2464651389 ecr 1034169111], length 228
16:39:28.110043 IP lamp-s-1vcpu-1gb-tor1-01.ssh > 198.96.84.204.47099: Flags [P.], seq 2612044:2612272, ack 1585, win 329, options [nop,nop,TS val 2464651389 ecr 1034169111], length 228
16:39:28.110139 IP lamp-s-1vcpu-1gb-tor1-01.ssh > 198.96.84.204.47099: Flags [P.], seq 2612272:2612500, ack 1585, win 329, options [nop,nop,TS val 2464651389 ecr 1034169111], length 228
16:39:28.110231 IP lamp-s-1vcpu-1gb-tor1-01.ssh > 198.96.84.204.47099: Flags [P.], seq 2612500:2612728, ack 1585, win 329, options [nop,nop,TS val 2464651389 ecr 1034169111], length 228
16:39:28.110321 IP lamp-s-1vcpu-1gb-tor1-01.ssh > 198.96.84.204.47099: Flags [P.], seq 2612728:2612956, ack 1585, win 329, options [nop,nop,TS val 2464651389 ecr 1034169111], length 228
16:39:28.110410 IP lamp-s-1vcpu-1gb-tor1-01.ssh > 198.96.84.204.47099: Flags [P.], seq 2612956:2613184, ack 1585, win 329, options [nop,nop,TS val 2464651389 ecr 1034169111], length 228
16:39:28.110516 IP lamp-s-1vcpu-1gb-tor1-01.ssh > 198.96.84.204.47099: Flags [P.], seq 2613184:2613412, ack 1585, win 329, options [nop,nop,TS val 2464651390 ecr 1034169111], length 228
16:39:28.110611 IP lamp-s-1vcpu-1gb-tor1-01.ssh > 198.96.84.204.47099: Flags [P.], seq 2613412:2613640, ack 1585, win 329, options [nop,nop,TS val 2464651390 ecr 1034169111], length 228
16:39:28.110702 IP lamp-s-1vcpu-1gb-tor1-01.ssh > 198.96.84.204.47099: Flags [P.], seq 2613640:2613868, ack 1585, win 329, options [nop,nop,TS val 2464651390 ecr 1034169111], length 228
16:39:28.110790 IP lamp-s-1vcpu-1gb-tor1-01.ssh > 198.96.84.204.47099: Flags [P.], seq 2613868:2614096, ack 1585, win 329, options [nop,nop,TS val 2464651390 ecr 1034169111], length 228
16:39:28.110891 IP lamp-s-1vcpu-1gb-tor1-01.ssh > 198.96.84.204.47099: Flags [P.], seq 2614096:2614324, ack 1585, win 329, options [nop,nop,TS val 2464651390 ecr 1034169111], length 228
16:39:28.110978 IP lamp-s-1vcpu-1gb-tor1-01.ssh > 198.96.84.204.47099: Flags [P.], seq 2614324:2614552, ack 1585, win 329, options [nop,nop,TS val 2464651390 ecr 1034169111], length 228
16:39:28.111065 IP lamp-s-1vcpu-1gb-tor1-01.ssh > 198.96.84.204.47099: Flags [P.], seq 2614552:2614780, ack 1585, win 329, options [nop,nop,TS val 2464651390 ecr 1034169111], length 228
16:39:28.111153 IP lamp-s-1vcpu-1gb-tor1-01.ssh > 198.96.84.204.47099: Flags [P.], seq 2614780:2615008, ack 1585, win 329, options [nop,nop,TS val 2464651390 ecr 1034169111], length 228
16:39:28.111244 IP lamp-s-1vcpu-1gb-tor1-01.ssh > 198.96.84.204.47099: Flags [P.], seq 2615008:2615236, ack 1585, win 329, options [nop,nop,TS val 2464651390 ecr 1034169111], length 228
16:39:28.111335 IP lamp-s-1vcpu-1gb-tor1-01.ssh > 198.96.84.204.47099: Flags [P.], seq 2615236:2615464, ack 1585, win 329, options [nop,nop,TS val 2464651390 ecr 1034169111], length 228
16:39:28.111424 IP lamp-s-1vcpu-1gb-tor1-01.ssh > 198.96.84.204.47099: Flags [P.], seq 2615464:2615692, ack 1585, win 329, options [nop,nop,TS val 2464651390 ecr 1034169111], length 228
16:39:28.111514 IP lamp-s-1vcpu-1gb-tor1-01.ssh > 198.96.84.204.47099: Flags [P.], seq 2615692:2615920, ack 1585, win 329, options [nop,nop,TS val 2464651391 ecr 1034169111], length 228
16:39:28.111605 IP lamp-s-1vcpu-1gb-tor1-01.ssh > 198.96.84.204.47099: Flags [P.], seq 2615920:2616148, ack 1585, win 329, options [nop,nop,TS val 2464651391 ecr 1034169111], length 228
16:39:28.111722 IP lamp-s-1vcpu-1gb-tor1-01.ssh > 198.96.84.204.47099: Flags [P.], seq 2616148:2616376, ack 1585, win 329, options [nop,nop,TS val 2464651391 ecr 1034169111], length 228
16:39:28.111812 IP lamp-s-1vcpu-1gb-tor1-01.ssh > 198.96.84.204.47099: Flags [P.], seq 2616376:2616604, ack 1585, win 329, options [nop,nop,TS val 2464651391 ecr 1034169111], length 228
16:39:28.111959 IP lamp-s-1vcpu-1gb-tor1-01.ssh > 198.96.84.204.47099: Flags [P.], seq 2616604:2616832, ack 1585, win 329, options [nop,nop,TS val 2464651391 ecr 1034169111], length 228
16:39:28.112062 IP lamp-s-1vcpu-1gb-tor1-01.ssh > 198.96.84.204.47099: Flags [P.], seq 2616832:2617060, ack 1585, win 329, options [nop,nop,TS val 2464651391 ecr 1034169111], length 228
16:39:28.112156 IP lamp-s-1vcpu-1gb-tor1-01.ssh > 198.96.84.204.47099: Flags [P.], seq 2617060:2617288, ack 1585, win 329, options [nop,nop,TS val 2464651391 ecr 1034169111], length 228
16:39:28.112245 IP lamp-s-1vcpu-1gb-tor1-01.ssh > 198.96.84.204.47099: Flags [P.], seq 2617288:2617516, ack 1585, win 329, options [nop,nop,TS val 2464651391 ecr 1034169111], length 228
16:39:28.112381 IP lamp-s-1vcpu-1gb-tor1-01.ssh > 198.96.84.204.47099: Flags [P.], seq 2617516:2617744, ack 1585, win 329, options [nop,nop,TS val 2464651391 ecr 1034169111], length 228
16:39:28.112485 IP lamp-s-1vcpu-1gb-tor1-01.ssh > 198.96.84.204.47099: Flags [P.], seq 2617744:2617972, ack 1585, win 329, options [nop,nop,TS val 2464651392 ecr 1034169111], length 228
16:39:28.112598 IP lamp-s-1vcpu-1gb-tor1-01.ssh > 198.96.84.204.47099: Flags [P.], seq 2617972:2618200, ack 1585, win 329, options [nop,nop,TS val 2464651392 ecr 1034169111], length 228
16:39:28.112690 IP lamp-s-1vcpu-1gb-tor1-01.ssh > 198.96.84.204.47099: Flags [P.], seq 2618200:2618428, ack 1585, win 329, options [nop,nop,TS val 2464651392 ecr 1034169111], length 228
16:39:28.112782 IP lamp-s-1vcpu-1gb-tor1-01.ssh > 198.96.84.204.47099: Flags [P.], seq 2618428:2618656, ack 1585, win 329, options [nop,nop,TS val 2464651392 ecr 1034169111], length 228
16:39:28.112873 IP lamp-s-1vcpu-1gb-tor1-01.ssh > 198.96.84.204.47099: Flags [P.], seq 2618656:2618884, ack 1585, win 329, options [nop,nop,TS val 2464651392 ecr 1034169111], length 228
16:39:28.112963 IP lamp-s-1vcpu-1gb-tor1-01.ssh > 198.96.84.204.47099: Flags [P.], seq 2618884:2619112, ack 1585, win 329, options [nop,nop,TS val 2464651392 ecr 1034169111], length 228
16:39:28.113038 IP lamp-s-1vcpu-1gb-tor1-01.ssh > 198.96.84.204.47099: Flags [P.], seq 2619112:2619340, ack 1585, win 329, options [nop,nop,TS val 2464651392 ecr 1034169111], length 228
16:39:28.113125 IP lamp-s-1vcpu-1gb-tor1-01.ssh > 198.96.84.204.47099: Flags [P.], seq 2619340:2619568, ack 1585, win 329, options [nop,nop,TS val 2464651392 ecr 1034169111], length 228
16:39:28.113213 IP lamp-s-1vcpu-1gb-tor1-01.ssh > 198.96.84.204.47099: Flags [P.], seq 2619568:2619796, ack 1585, win 329, options [nop,nop,TS val 2464651392 ecr 1034169111], length 228
16:39:28.113300 IP lamp-s-1vcpu-1gb-tor1-01.ssh > 198.96.84.204.47099: Flags [P.], seq 2619796:2620024, ack 1585, win 329, options [nop,nop,TS val 2464651392 ecr 1034169111], length 228
16:39:28.113388 IP lamp-s-1vcpu-1gb-tor1-01.ssh > 198.96.84.204.47099: Flags [P.], seq 2620024:2620252, ack 1585, win 329, options [nop,nop,TS val 2464651392 ecr 1034169111], length 228
16:39:28.113486 IP lamp-s-1vcpu-1gb-tor1-01.ssh > 198.96.84.204.47099: Flags [P.], seq 2620252:2620480, ack 1585, win 329, options [nop,nop,TS val 2464651393 ecr 1034169111], length 228
16:39:28.113577 IP lamp-s-1vcpu-1gb-tor1-01.ssh > 198.96.84.204.47099: Flags [P.], seq 2620480:2620708, ack 1585, win 329, options [nop,nop,TS val 2464651393 ecr 1034169111], length 228
16:39:28.113668 IP lamp-s-1vcpu-1gb-tor1-01.ssh > 198.96.84.204.47099: Flags [P.], seq 2620708:2620936, ack 1585, win 329, options [nop,nop,TS val 2464651393 ecr 1034169111], length 228
16:39:28.113756 IP lamp-s-1vcpu-1gb-tor1-01.ssh > 198.96.84.204.47099: Flags [P.], seq 2620936:2621164, ack 1585, win 329, options [nop,nop,TS val 2464651393 ecr 1034169111], length 228
16:39:28.113846 IP lamp-s-1vcpu-1gb-tor1-01.ssh > 198.96.84.204.47099: Flags [P.], seq 2621164:2621392, ack 1585, win 329, options [nop,nop,TS val 2464651393 ecr 1034169111], length 228
16:39:28.113935 IP lamp-s-1vcpu-1gb-tor1-01.ssh > 198.96.84.204.47099: Flags [P.], seq 2621392:2621620, ack 1585, win 329, options [nop,nop,TS val 2464651393 ecr 1034169111], length 228
16:39:28.114037 IP lamp-s-1vcpu-1gb-tor1-01.ssh > 198.96.84.204.47099: Flags [P.], seq 2621620:2621848, ack 1585, win 329, options [nop,nop,TS val 2464651393 ecr 1034169111], length 228
16:39:28.115947 IP 198.96.84.204.47099 > lamp-s-1vcpu-1gb-tor1-01.ssh: Flags [.], ack 2589816, win 3892, options [nop,nop,TS val 1034169113 ecr 2464651380], length 0
16:39:28.115991 IP lamp-s-1vcpu-1gb-tor1-01.ssh > 198.96.84.204.47099: Flags [P.], seq 2621848:2622076, ack 1585, win 329, options [nop,nop,TS val 2464651395 ecr 1034169113], length 228
16:39:28.116012 IP 198.96.84.204.47099 > lamp-s-1vcpu-1gb-tor1-01.ssh: Flags [.], ack 2590044, win 3888, options [nop,nop,TS val 1034169113 ecr 2464651380], length 0
16:39:28.116121 IP 198.96.84.204.47099 > lamp-s-1vcpu-1gb-tor1-01.ssh: Flags [.], ack 2590272, win 3884, options [nop,nop,TS val 1034169113 ecr 2464651381], length 0
16:39:28.116134 IP 198.96.84.204.47099 > lamp-s-1vcpu-1gb-tor1-01.ssh: Flags [.], ack 2590500, win 3892, options [nop,nop,TS val 1034169113 ecr 2464651381], length 0
16:39:28.116140 IP 198.96.84.204.47099 > lamp-s-1vcpu-1gb-tor1-01.ssh: Flags [.], ack 2590728, win 3888, options [nop,nop,TS val 1034169113 ecr 2464651381], length 0
16:39:28.116146 IP 198.96.84.204.47099 > lamp-s-1vcpu-1gb-tor1-01.ssh: Flags [.], ack 2590956, win 3884, options [nop,nop,TS val 1034169113 ecr 2464651381], length 0
16:39:28.116154 IP 198.96.84.204.47099 > lamp-s-1vcpu-1gb-tor1-01.ssh: Flags [.], ack 2591184, win 3881, options [nop,nop,TS val 1034169113 ecr 2464651381], length 0