6:31:46.119786 IP lamp-s-1vcpu-1gb-tor1-01.ssh > 198.96.84.204.47099: Flags [P.], seq 718613960:718614188, ack 446601, win 329, options [nop,nop,TS val 2464189398 ecr 1033708770], length 228
16:31:46.119853 IP lamp-s-1vcpu-1gb-tor1-01.ssh > 198.96.84.204.47099: Flags [P.], seq 718614188:718614416, ack 446601, win 329, options [nop,nop,TS val 2464189398 ecr 1033708770], length 228
16:31:46.119935 IP lamp-s-1vcpu-1gb-tor1-01.ssh > 198.96.84.204.47099: Flags [P.], seq 718614416:718614644, ack 446601, win 329, options [nop,nop,TS val 2464189398 ecr 1033708770], length 228
16:31:46.120017 IP lamp-s-1vcpu-1gb-tor1-01.ssh > 198.96.84.204.47099: Flags [P.], seq 718614644:718614872, ack 446601, win 329, options [nop,nop,TS val 2464189398 ecr 1033708770], length 228
16:31:46.120096 IP lamp-s-1vcpu-1gb-tor1-01.ssh > 198.96.84.204.47099: Flags [P.], seq 718614872:718615100, ack 446601, win 329, options [nop,nop,TS val 2464189398 ecr 1033708770], length 228
16:31:46.120173 IP lamp-s-1vcpu-1gb-tor1-01.ssh > 198.96.84.204.47099: Flags [P.], seq 718615100:718615328, ack 446601, win 329, options [nop,nop,TS val 2464189398 ecr 1033708770], length 228
16:31:46.120248 IP lamp-s-1vcpu-1gb-tor1-01.ssh > 198.96.84.204.47099: Flags [P.], seq 718615328:718615556, ack 446601, win 329, options [nop,nop,TS val 2464189398 ecr 1033708770], length 228
16:31:46.120359 IP lamp-s-1vcpu-1gb-tor1-01.ssh > 198.96.84.204.47099: Flags [P.], seq 718615556:718615784, ack 446601, win 329, options [nop,nop,TS val 2464189398 ecr 1033708770], length 228
16:31:46.120444 IP lamp-s-1vcpu-1gb-tor1-01.ssh > 198.96.84.204.47099: Flags [P.], seq 718615784:718616012, ack 446601, win 329, options [nop,nop,TS val 2464189398 ecr 1033708770], length 228
16:31:46.120526 IP lamp-s-1vcpu-1gb-tor1-01.ssh > 198.96.84.204.47099: Flags [P.], seq 718616012:718616240, ack 446601, win 329, options [nop,nop,TS val 2464189398 ecr 1033708770], length 228
16:31:46.120608 IP lamp-s-1vcpu-1gb-tor1-01.ssh > 198.96.84.204.47099: Flags [P.], seq 718616240:718616468, ack 446601, win 329, options [nop,nop,TS val 2464189399 ecr 1033708770], length 228
16:31:46.120677 IP lamp-s-1vcpu-1gb-tor1-01.ssh > 198.96.84.204.47099: Flags [P.], seq 718616468:718616696, ack 446601, win 329, options [nop,nop,TS val 2464189399 ecr 1033708770], length 228
16:31:46.120756 IP lamp-s-1vcpu-1gb-tor1-01.ssh > 198.96.84.204.47099: Flags [P.], seq 718616696:718616924, ack 446601, win 329, options [nop,nop,TS val 2464189399 ecr 1033708770], length 228
16:31:46.120834 IP lamp-s-1vcpu-1gb-tor1-01.ssh > 198.96.84.204.47099: Flags [P.], seq 718616924:718617152, ack 446601, win 329, options [nop,nop,TS val 2464189399 ecr 1033708770], length 228
16:31:46.120914 IP lamp-s-1vcpu-1gb-tor1-01.ssh > 198.96.84.204.47099: Flags [P.], seq 718617152:718617380, ack 446601, win 329, options [nop,nop,TS val 2464189399 ecr 1033708770], length 228
16:31:46.120991 IP lamp-s-1vcpu-1gb-tor1-01.ssh > 198.96.84.204.47099: Flags [P.], seq 718617380:718617608, ack 446601, win 329, options [nop,nop,TS val 2464189399 ecr 1033708770], length 228
16:31:46.121069 IP lamp-s-1vcpu-1gb-tor1-01.ssh > 198.96.84.204.47099: Flags [P.], seq 718617608:718617836, ack 446601, win 329, options [nop,nop,TS val 2464189399 ecr 1033708770], length 228
16:31:46.121145 IP lamp-s-1vcpu-1gb-tor1-01.ssh > 198.96.84.204.47099: Flags [P.], seq 718617836:718618064, ack 446601, win 329, options [nop,nop,TS val 2464189399 ecr 1033708770], length 228
16:31:46.121222 IP lamp-s-1vcpu-1gb-tor1-01.ssh > 198.96.84.204.47099: Flags [P.], seq 718618064:718618292, ack 446601, win 329, options [nop,nop,TS val 2464189399 ecr 1033708770], length 228
16:31:46.121303 IP lamp-s-1vcpu-1gb-tor1-01.ssh > 198.96.84.204.47099: Flags [P.], seq 718618292:718618520, ack 446601, win 329, options [nop,nop,TS val 2464189399 ecr 1033708770], length 228
16:31:46.121385 IP lamp-s-1vcpu-1gb-tor1-01.ssh > 198.96.84.204.47099: Flags [P.], seq 718618520:718618748, ack 446601, win 329, options [nop,nop,TS val 2464189399 ecr 1033708770], length 228
16:31:46.121466 IP lamp-s-1vcpu-1gb-tor1-01.ssh > 198.96.84.204.47099: Flags [P.], seq 718618748:718618976, ack 446601, win 329, options [nop,nop,TS val 2464189399 ecr 1033708770], length 228
16:31:46.121546 IP lamp-s-1vcpu-1gb-tor1-01.ssh > 198.96.84.204.47099: Flags [P.], seq 718618976:718619204, ack 446601, win 329, options [nop,nop,TS val 2464189399 ecr 1033708770], length 228
16:31:46.121625 IP lamp-s-1vcpu-1gb-tor1-01.ssh > 198.96.84.204.47099: Flags [P.], seq 718619204:718619432, ack 446601, win 329, options [nop,nop,TS val 2464189400 ecr 1033708770], length 228
16:31:46.121706 IP lamp-s-1vcpu-1gb-tor1-01.ssh > 198.96.84.204.47099: Flags [P.], seq 718619432:718619660, ack 446601, win 329, options [nop,nop,TS val 2464189400 ecr 1033708770], length 228
16:31:46.121784 IP lamp-s-1vcpu-1gb-tor1-01.ssh > 198.96.84.204.47099: Flags [P.], seq 718619660:718619888, ack 446601, win 329, options [nop,nop,TS val 2464189400 ecr 1033708770], length 228
16:31:46.121859 IP lamp-s-1vcpu-1gb-tor1-01.ssh > 198.96.84.204.47099: Flags [P.], seq 718619888:718620116, ack 446601, win 329, options [nop,nop,TS val 2464189400 ecr 1033708770], length 228
16:31:46.121935 IP lamp-s-1vcpu-1gb-tor1-01.ssh > 198.96.84.204.47099: Flags [P.], seq 718620116:718620344, ack 446601, win 329, options [nop,nop,TS val 2464189400 ecr 1033708770], length 228
16:31:46.122013 IP lamp-s-1vcpu-1gb-tor1-01.ssh > 198.96.84.204.47099: Flags [P.], seq 718620344:718620572, ack 446601, win 329, options [nop,nop,TS val 2464189400 ecr 1033708770], length 228
16:31:46.122081 IP 198.96.84.204.47099 > lamp-s-1vcpu-1gb-tor1-01.ssh: Flags [P.], seq 446601:446637, ack 718572984, win 3329, options [nop,nop,TS val 1033708794 ecr 2464189343], length 36
16:31:46.122106 IP 198.96.84.204.47099 > lamp-s-1vcpu-1gb-tor1-01.ssh: Flags [.], ack 718573212, win 3326, options [nop,nop,TS val 1033708804 ecr 2464189381], length 0
16:31:46.122115 IP 198.96.84.204.47099 > lamp-s-1vcpu-1gb-tor1-01.ssh: Flags [.], ack 718574456, win 3306, options [nop,nop,TS val 1033708804 ecr 2464189381], length 0
16:31:46.122121 IP 198.96.84.204.47099 > lamp-s-1vcpu-1gb-tor1-01.ssh: Flags [.], ack 718574684, win 3303, options [nop,nop,TS val 1033708804 ecr 2464189381], length 0
16:31:46.122126 IP 198.96.84.204.47099 > lamp-s-1vcpu-1gb-tor1-01.ssh: Flags [.], ack 718574912, win 3299, options [nop,nop,TS val 1033708804 ecr 2464189381], length 0
16:31:46.122131 IP 198.96.84.204.47099 > lamp-s-1vcpu-1gb-tor1-01.ssh: Flags [.], ack 718575140, win 3296, options [nop,nop,TS val 1033708804 ecr 2464189382], length 0
16:31:46.122248 IP 198.96.84.204.47099 > lamp-s-1vcpu-1gb-tor1-01.ssh: Flags [.], ack 718577876, win 3297, options [nop,nop,TS val 1033708804 ecr 2464189385], length 0
16:31:46.122260 IP 198.96.84.204.47099 > lamp-s-1vcpu-1gb-tor1-01.ssh: Flags [.], ack 718579120, win 3278, options [nop,nop,TS val 1033708804 ecr 2464189386], length 0
^C
3395871 packets captured
5013240 packets received by filter
1617369 packets dropped by kernel
root@lamp-s-1vcpu-1gb-tor1-01:~# 